{
  "workflow_id": "wf_spotify_onboarding_001",
  "tenant_id": "tenant_spotify",
  "project_id": "proj_spotify_activation",
  "stage_id": "discovery",
  "agent_name": "DiscoveryAgent",
  "entry_mode": "goal_driven",
  "user_intent": {
    "goal": "Increase paid conversion and first-week listening retention for new Spotify Free users.",
    "feedback_summary": null
  },
  "context": {
    "company_context_refs": [
      "doc_spotify_onboarding_strategy",
      "doc_premium_conversion_research"
    ],
    "prior_stage_refs": [],
    "retrieval_refs": [
      "rag_spotify_new_user_flow",
      "rag_spotify_support_tickets"
    ],
    "memory_refs": [
      "mem_spotify_product_language"
    ],
    "source_notes": "Spotify data shows many newly signed-up users do not reach their first personalized playlist session within seven days. Support tickets mention confusion about where to start after account creation, and onboarding emails are not consistently driving the right next step."
  },
  "instructions": {
    "task": "Frame the product discovery problem for Spotify onboarding and conversion.",
    "constraints": [
      "Do not propose a final solution yet.",
      "Ground every major claim in the provided context."
    ],
    "success_criteria": [
      "Clear problem statement",
      "Explicit assumptions",
      "Reviewable open questions"
    ],
    "output_style": "concise_product_discovery"
  },
  "budgets": {
    "token_budget": 4000,
    "latency_budget_ms": 120000,
    "retry_count": 0,
    "cost_budget_usd": 0.25
  },
  "policy": {
    "approval_required": true,
    "can_write_memory": false,
    "can_publish": false,
    "sensitivity": "internal"
  },
  "status": "success",
  "timestamp": "2026-07-18T14:37:25.796146+00:00",
  "input": {
    "mode": "goal_driven",
    "goal": "Increase paid conversion and first-week listening retention for new Spotify Free users.",
    "feedback_summary": null,
    "target_segment": "new Spotify Free users in the US",
    "time_horizon": "the next quarter",
    "business_context": "Spotify data shows many newly signed-up users do not reach their first personalized playlist session within seven days. Support tickets mention confusion about where to start after account creation, and onboarding emails are not consistently driving the right next step.",
    "constraints": [
      "Do not propose a final solution yet.",
      "Ground every major claim in the provided context."
    ],
    "supporting_links": []
  },
  "structured_output": {
    "problem_statement": "new Spotify Free users in the US need a clearer path from the stated business goal to a solvable product problem: Increase paid conversion and first-week listening retention for new Spotify Free users. The discovery focus is to define the user behavior, constraint, or unmet need that most directly blocks that goal.",
    "why_now": "The business goal creates a timely need to clarify the product problem before solutioning. The strongest available signal is: Spotify data shows many newly signed-up users do not reach their first personalized playlist session within seven days. Support tickets mention confusion about where to start af....",
    "problem_scope": {
      "in_scope": [
        "User journey and product area connected to: Increase paid conversion and first-week listening retention for new Spotify Free users",
        "Needs, blockers, and motivations for new Spotify Free users in the US",
        "Metrics that can prove the problem is improving",
        "Evidence-backed assumptions that need validation"
      ],
      "out_of_scope": [
        "Final solution selection",
        "Detailed engineering implementation",
        "Unapproved roadmap commitment",
        "Work that violates constraint: Do not propose a final solution yet.",
        "Work that violates constraint: Ground every major claim in the provided context."
      ]
    },
    "key_assumptions": [
      "The stated input represents a meaningful product or business signal.",
      "The issue can be improved through product intervention rather than only process or go-to-market changes.",
      "The team can access enough evidence to validate the problem before committing to a solution."
    ],
    "open_questions": [
      "Which user segment is most affected by this problem?",
      "What metric currently proves the problem exists?",
      "What behavior change would show that the problem is solved?"
    ],
    "success_definition": "Success means new Spotify Free users in the US show measurable improvement in the behavior or outcome blocked by 'Increase paid conversion and first-week listening retention for new Spotify Free users' within the next quarter, without harming guardrail metrics.",
    "evidence_map": [
      {
        "claim": "new Spotify Free users in the US need a clearer path from the stated business goal to a solvable product problem: Increase paid conversion and first-week listening retention for new Spotify Free users. The discovery focus is to define the user behavior, constraint, or unmet need that most directly blocks that goal.",
        "source_id": "rag_spotify_new_user_flow",
        "note": "Primary claim for discovery framing."
      },
      {
        "claim": "The business goal creates a timely need to clarify the product problem before solutioning. The strongest available signal is: Spotify data shows many newly signed-up users do not reach their first personalized playlist session within seven days. Support tickets mention confusion about where to start af....",
        "source_id": "rag_spotify_support_tickets",
        "note": "Timing and urgency claim."
      }
    ]
  },
  "citations": [
    {
      "source_id": "rag_spotify_new_user_flow",
      "claim": "new Spotify Free users in the US need a clearer path from the stated business goal to a solvable product problem: Increase paid conversion and first-week listening retention for new Spotify Free users. The discovery focus is to define the user behavior, constraint, or unmet need that most directly blocks that goal.",
      "source_type": "rag",
      "excerpt": "Spotify data shows many newly signed-up users do not reach their first personalized playlist session within seven days. Support tickets mention confusion about where to start af...",
      "confidence": 0.82,
      "trust_score": 0.82,
      "relevance_score": 0.82
    },
    {
      "source_id": "rag_spotify_support_tickets",
      "claim": "The business goal creates a timely need to clarify the product problem before solutioning. The strongest available signal is: Spotify data shows many newly signed-up users do not reach their first personalized playlist session within seven days. Support tickets mention confusion about where to start af....",
      "source_type": "rag",
      "excerpt": "Spotify data shows many newly signed-up users do not reach their first personalized playlist session within seven days. Support tickets mention confusion about where to start af...",
      "confidence": 0.82,
      "trust_score": 0.82,
      "relevance_score": 0.82
    }
  ],
  "assumptions": [
    "The stated input represents a meaningful product or business signal.",
    "The issue can be improved through product intervention rather than only process or go-to-market changes.",
    "The team can access enough evidence to validate the problem before committing to a solution."
  ],
  "open_questions": [
    "Which user segment is most affected by this problem?",
    "What metric currently proves the problem exists?",
    "What behavior change would show that the problem is solved?"
  ],
  "warnings": [],
  "errors": [],
  "metrics": {
    "latency_ms": 935.695,
    "token_input": 16,
    "token_output": 524,
    "cost_usd": 0,
    "retry_count": 0,
    "input_completeness": 1.0,
    "output_completeness": 1.0,
    "citation_coverage": 1.0,
    "hallucination_risk": 0.18,
    "consistency_score": 1.0,
    "confidence_score": 0.82,
    "instruction_following": 0.92,
    "business_logic_score": 0.84,
    "problem_clarity_score": 1.0,
    "scope_precision": 1.0,
    "assumption_quality_score": 0.75,
    "evidence_to_claim_ratio": 1.0,
    "root_cause_confidence": 0.72,
    "open_question_count": 3
  },
  "evaluation": {
    "schema_valid": true,
    "citation_coverage": 1.0,
    "citation_quality": 0.82,
    "hallucination_risk": 0.18,
    "completeness": 1.0,
    "consistency": 1.0,
    "instruction_following": 0.92,
    "confidence_calibration": 0.82,
    "business_logic_score": 0.84,
    "overall_score": 0.925,
    "decision": "pass",
    "reasons": [
      "All required discovery output fields are present.",
      "Core discovery claims include citation coverage.",
      "The problem statement is specific enough for downstream KPI work."
    ],
    "required_actions": [],
    "retry_recommended": false,
    "human_review_required": true
  },
  "next_action": "continue_to_kpi_tree",
  "artifact_ref": "art_85524807b8554018",
  "version": "discovery-agent-v1"
}